{
  "actions": {
    "coordinator.index.apply": {
      "taskId": "wt:index:apply"
    },
    "coordinator.index.build": {
      "taskId": "wt:index:build"
    },
    "coordinator.poll-triggers": {
      "taskId": "wt:coordinator:poll-triggers"
    },
    "effect.dispatchBatch": {
      "taskId": "wt:tmux:effect"
    },
    "git.publish-commits": {
      "taskId": "wt:git:publish-commits"
    },
    "git.record-acceptance": {
      "taskId": "wt:git:record-acceptance"
    },
    "runtime.smoke": {
      "taskId": "wt:runtime:smoke"
    }
  },
  "catalogId": "watchtower-runtime-nvb/v1",
  "catalogVersion": 1,
  "fragments": [
    "schema-composition",
    "catalog-composition",
    "coordinator-watch",
    "git-acceptance",
    "index-build",
    "runtime-smoke",
    "tmux-effect"
  ],
  "groups": {},
  "handlers": {
    "CoordinatorWatchTaskHandler": {
      "module": "./handlers/CoordinatorWatchTaskHandler.js"
    },
    "GitAcceptanceTaskHandler": {
      "module": "./handlers/GitAcceptanceTaskHandler.js"
    },
    "IndexBuildTaskHandler": {
      "module": "./handlers/IndexBuildTaskHandler.js"
    },
    "RuntimeSmokeTaskHandler": {
      "module": "./handlers/RuntimeSmokeTaskHandler.js"
    },
    "SchemaCompositionTaskHandler": {
      "module": "./handlers/SchemaCompositionTaskHandler.js"
    },
    "TaskCatalogCompositionTaskHandler": {
      "module": "./handlers/TaskCatalogCompositionTaskHandler.js"
    },
    "TmuxEffectTaskHandler": {
      "module": "./handlers/tmux/TmuxEffectTaskHandler.js"
    }
  },
  "leaves": {
    "git.push": {
      "executable": true,
      "mode": "0555",
      "path": "./leaves/gitPush.sh",
      "sha256": "sha256:79031c3060a8f1e1fb79a377603a203e5c32caf40172898ba4acfb2c61259510"
    },
    "runtime.echo": {
      "executable": true,
      "mode": "0555",
      "path": "./leaves/runtimeEcho.sh",
      "sha256": "sha256:306c6ca7407560340797866e077e053627ad409277d1b9da58106fce4cf717cb"
    },
    "tmux.command": {
      "executable": true,
      "mode": "0555",
      "path": "./leaves/tmuxCommand.sh",
      "sha256": "sha256:f405d7f4a1c2948d50bc157359d9dd916ce784e047d2c9d363c03709a994cfb7"
    }
  },
  "minimumRuntime": {
    "cliVersion": "0.1.0",
    "nodeVersion": "26.4.0"
  },
  "profiles": {
    "implementation-v1": {
      "taskIds": [
        "wt:git:publish-commits",
        "wt:git:record-acceptance",
        "wt:index:apply",
        "wt:index:build",
        "wt:runtime:smoke",
        "wt:tmux:effect"
      ]
    }
  },
  "schemaVersion": 1,
  "schemas": {
    "watchtower://runtime/schemas/coordinator-poll-triggers-input/v1": {
      "path": "./schemas/coordinatorPollTriggersInput.schema.json",
      "sha256": "sha256:df35e44fde356c770ac7910d91b25320f08b4fac3a7c0a8b8c02e33fb68cfb51"
    },
    "watchtower://runtime/schemas/coordinator-poll-triggers-result/v1": {
      "path": "./schemas/coordinatorPollTriggersResult.schema.json",
      "sha256": "sha256:ca931c594e789b55fde549c5ba12b9e4e8741fe91064e135c49f25dd92eccf3a"
    },
    "watchtower://runtime/schemas/git-publish-commits-input/v1": {
      "path": "./schemas/gitPublishCommitsInput.schema.json",
      "sha256": "sha256:3dda7a1a1ca0a9fab9add85be1fd05537cc169c5f0b9a874afb5d0bdc07c24da"
    },
    "watchtower://runtime/schemas/git-publish-commits-result/v1": {
      "path": "./schemas/gitPublishCommitsResult.schema.json",
      "sha256": "sha256:d9ccb81892dc44134a85bb92bb919ba23f152bc6240917831e02bf85c90ed6e5"
    },
    "watchtower://runtime/schemas/git-record-acceptance-input/v1": {
      "path": "./schemas/gitRecordAcceptanceInput.schema.json",
      "sha256": "sha256:c2e456c8100a8ed41e03dd6fb3c945b293e70f3c38b164610fdb9db0e1a10d8e"
    },
    "watchtower://runtime/schemas/git-record-acceptance-result/v1": {
      "path": "./schemas/gitRecordAcceptanceResult.schema.json",
      "sha256": "sha256:3f128cb82cf5750eedf5e668057add7e564145ea2f4819976417a70f72d9f3d7"
    },
    "watchtower://runtime/schemas/index-build-apply-input/v1": {
      "path": "./schemas/indexBuildApplyInput.schema.json",
      "sha256": "sha256:8909a9bb663eed16ffa2f009f6f97fbedbb5cf3ea76c9b1cbe3cb14a474e347c"
    },
    "watchtower://runtime/schemas/index-build-apply-result/v1": {
      "path": "./schemas/indexBuildApplyResult.schema.json",
      "sha256": "sha256:6f32425ac467c01ef20003ea4d81d49633b3b289394d7a84bae697a084bf5d38"
    },
    "watchtower://runtime/schemas/index-build-input/v1": {
      "path": "./schemas/indexBuildInput.schema.json",
      "sha256": "sha256:39606378072219f2be2be39d314bf205bdaa089589fa1733d7eae6e2654af5d1"
    },
    "watchtower://runtime/schemas/index-build-result/v1": {
      "path": "./schemas/indexBuildResult.schema.json",
      "sha256": "sha256:9cc24b854dbab9a9b6c283060d7abd041049c6b8820c7414e9232883d5ecd740"
    },
    "watchtower://runtime/schemas/lane-task-profile/v1": {
      "path": "./schemas/laneTaskProfile.schema.json",
      "sha256": "sha256:91bcf114ef202f23f10436a960d029420505beeaffa45115462d8a774d59d0da"
    },
    "watchtower://runtime/schemas/runtime-nvb-config/v1": {
      "path": "./schemas/runtimeNvbConfig.schema.json",
      "sha256": "sha256:9b0d79ef3d92cb40903cd3bfa7fa527ee80cc8a904a0bfe75f728dfae21c889c"
    },
    "watchtower://runtime/schemas/runtime-smoke-input/v1": {
      "path": "./schemas/runtimeSmokeInput.schema.json",
      "sha256": "sha256:7857d8a819a9c31dc7d5bc6dd9cb73d2c819f6c60c3447db81863f3ae9e7c541"
    },
    "watchtower://runtime/schemas/runtime-smoke-result/v1": {
      "path": "./schemas/runtimeSmokeResult.schema.json",
      "sha256": "sha256:89150d0b75550cd140571642dfe42165ab728f1ea6d2fd17c24b3b80ef62b4d6"
    },
    "watchtower://runtime/schemas/schema-composition-input/v1": {
      "path": "./schemas/schemaCompositionInput.schema.json",
      "sha256": "sha256:ba8e6c8559eaaf8026562d7a2a89e3be0b295def2dde146c6f682ecd84df1bb5"
    },
    "watchtower://runtime/schemas/schema-composition-result/v1": {
      "path": "./schemas/schemaCompositionResult.schema.json",
      "sha256": "sha256:f9a7b920c7ace5002911921722a32ee97245c4a2d844ccdc6ba96a90a70bc77e"
    },
    "watchtower://runtime/schemas/task-catalog-composition-input/v1": {
      "path": "./schemas/taskCatalogCompositionInput.schema.json",
      "sha256": "sha256:026af3b341756eb00ecfea9a60636aa8714bf59bfbcc25f2a90eda6cfa312804"
    },
    "watchtower://runtime/schemas/task-catalog-composition-result/v1": {
      "path": "./schemas/taskCatalogCompositionResult.schema.json",
      "sha256": "sha256:f78508508f798aa3866cb5c361fb9007e72944e7a4c9477abf6584d0f1e99d48"
    },
    "watchtower://runtime/schemas/task-catalog-fragment/v1": {
      "path": "./schemas/taskCatalogFragment.schema.json",
      "sha256": "sha256:49aa5da9ca41d63564dd308cc968ba3e4c83a66180960304087f58ef4aff16a0"
    },
    "watchtower://runtime/schemas/task-catalog/v1": {
      "path": "./schemas/taskCatalog.schema.json",
      "sha256": "sha256:747142c4e30dac1c42e8e716055355a8f0fba10ab982170ed9f6bf99aadd7dc2"
    },
    "watchtower://runtime/schemas/tmux-effect-input/v1": {
      "path": "./schemas/tmuxEffectInput.schema.json",
      "sha256": "sha256:1f7b65b0b3bd35ba89ce2afa6659b0b7441d8bd8592a43e568aa26d5d5f58277"
    },
    "watchtower://runtime/schemas/tmux-effect-result/v1": {
      "path": "./schemas/tmuxEffectResult.schema.json",
      "sha256": "sha256:2db9201bac63bc5c4d65301d70a2650116c72202df5cfd58d2f9b79be099e80e"
    }
  },
  "tasks": {
    "wt:coordinator:poll-triggers": {
      "executionScope": "lane-runtime",
      "handlerId": "CoordinatorWatchTaskHandler",
      "inputSchema": "watchtower://runtime/schemas/coordinator-poll-triggers-input/v1",
      "leafIds": [],
      "mutationClass": "read-only",
      "requiresInvocationEnvelope": false,
      "resultSchema": "watchtower://runtime/schemas/coordinator-poll-triggers-result/v1"
    },
    "wt:git:publish-commits": {
      "executionScope": "lane-runtime",
      "handlerId": "GitAcceptanceTaskHandler",
      "inputSchema": "watchtower://runtime/schemas/git-publish-commits-input/v1",
      "leafIds": [
        "git.push"
      ],
      "mutationClass": "external-effect",
      "requiresInvocationEnvelope": true,
      "resultSchema": "watchtower://runtime/schemas/git-publish-commits-result/v1"
    },
    "wt:git:record-acceptance": {
      "executionScope": "lane-runtime",
      "handlerId": "GitAcceptanceTaskHandler",
      "inputSchema": "watchtower://runtime/schemas/git-record-acceptance-input/v1",
      "leafIds": [],
      "mutationClass": "authoritative-effect",
      "requiresInvocationEnvelope": true,
      "resultSchema": "watchtower://runtime/schemas/git-record-acceptance-result/v1"
    },
    "wt:index:apply": {
      "executionScope": "lane-runtime",
      "handlerId": "IndexBuildTaskHandler",
      "inputSchema": "watchtower://runtime/schemas/index-build-apply-input/v1",
      "leafIds": [],
      "mutationClass": "authoritative-effect",
      "requiresInvocationEnvelope": true,
      "resultSchema": "watchtower://runtime/schemas/index-build-apply-result/v1"
    },
    "wt:index:build": {
      "executionScope": "lane-runtime",
      "handlerId": "IndexBuildTaskHandler",
      "inputSchema": "watchtower://runtime/schemas/index-build-input/v1",
      "leafIds": [],
      "mutationClass": "read-only",
      "requiresInvocationEnvelope": false,
      "resultSchema": "watchtower://runtime/schemas/index-build-result/v1"
    },
    "wt:runtime:catalog:check": {
      "executionScope": "repository-development",
      "handlerId": "TaskCatalogCompositionTaskHandler",
      "inputSchema": "watchtower://runtime/schemas/task-catalog-composition-input/v1",
      "leafIds": [],
      "mutationClass": "read-only",
      "requiresInvocationEnvelope": false,
      "resultSchema": "watchtower://runtime/schemas/task-catalog-composition-result/v1"
    },
    "wt:runtime:catalog:generate": {
      "executionScope": "repository-development",